{
  "schema_version": "oio.project-issue-log-ontology.v1",
  "project_id": "owner/repository",
  "namespace": "project",
  "extends": {
    "ontology_id": "oio:issue-log",
    "version": "1.0.0"
  },
  "version": "1.0.0",
  "concepts": [],
  "priorities": [
    {
      "path": "1",
      "concept_id": "project:priority-1",
      "label": "Project priority 1",
      "definition": "Adopter queue position 1; replace or refine this meaning in the project extension before relying on it for substantive triage."
    },
    {
      "path": "2",
      "concept_id": "project:priority-2",
      "label": "Project priority 2",
      "definition": "Adopter queue position 2; replace or refine this meaning in the project extension before relying on it for substantive triage."
    },
    {
      "path": "3",
      "concept_id": "project:priority-3",
      "label": "Project priority 3",
      "definition": "Adopter queue position 3; replace or refine this meaning in the project extension before relying on it for substantive triage."
    },
    {
      "path": "4",
      "concept_id": "project:priority-4",
      "label": "Project priority 4",
      "definition": "Adopter queue position 4; replace or refine this meaning in the project extension before relying on it for substantive triage."
    },
    {
      "path": "5",
      "concept_id": "project:priority-5",
      "label": "Project priority 5",
      "definition": "Adopter queue position 5; replace or refine this meaning in the project extension before relying on it for substantive triage."
    },
    {
      "path": "6",
      "concept_id": "project:priority-6",
      "label": "Project priority 6",
      "definition": "Adopter queue position 6; replace or refine this meaning in the project extension before relying on it for substantive triage."
    },
    {
      "path": "7",
      "concept_id": "project:priority-7",
      "label": "Project priority 7",
      "definition": "Adopter queue position 7; replace or refine this meaning in the project extension before relying on it for substantive triage."
    },
    {
      "path": "8",
      "concept_id": "project:priority-8",
      "label": "Project priority 8",
      "definition": "Adopter queue position 8; replace or refine this meaning in the project extension before relying on it for substantive triage."
    },
    {
      "path": "9",
      "concept_id": "project:priority-9",
      "label": "Project priority 9",
      "definition": "Adopter queue position 9; replace or refine this meaning in the project extension before relying on it for substantive triage."
    },
    {
      "path": "10",
      "concept_id": "project:priority-10",
      "label": "Project priority 10",
      "definition": "Adopter queue position 10; replace or refine this meaning in the project extension before relying on it for substantive triage."
    },
    {
      "path": "11",
      "concept_id": "project:priority-11",
      "label": "Project priority 11",
      "definition": "Adopter queue position 11; replace or refine this meaning in the project extension before relying on it for substantive triage."
    },
    {
      "path": "12",
      "concept_id": "project:priority-12",
      "label": "Project priority 12",
      "definition": "Adopter queue position 12; replace or refine this meaning in the project extension before relying on it for substantive triage."
    },
    {
      "path": "13",
      "concept_id": "project:priority-13",
      "label": "Project priority 13",
      "definition": "Adopter queue position 13; replace or refine this meaning in the project extension before relying on it for substantive triage."
    },
    {
      "path": "14",
      "concept_id": "project:priority-14",
      "label": "Project priority 14",
      "definition": "Adopter queue position 14; replace or refine this meaning in the project extension before relying on it for substantive triage."
    },
    {
      "path": "15",
      "concept_id": "project:priority-15",
      "label": "Project priority 15",
      "definition": "Adopter queue position 15; replace or refine this meaning in the project extension before relying on it for substantive triage."
    },
    {
      "path": "16",
      "concept_id": "project:priority-16",
      "label": "Project priority 16",
      "definition": "Adopter queue position 16; replace or refine this meaning in the project extension before relying on it for substantive triage."
    },
    {
      "path": "17",
      "concept_id": "project:priority-17",
      "label": "Project priority 17",
      "definition": "Adopter queue position 17; replace or refine this meaning in the project extension before relying on it for substantive triage."
    },
    {
      "path": "18",
      "concept_id": "project:priority-18",
      "label": "Project priority 18",
      "definition": "Adopter queue position 18; replace or refine this meaning in the project extension before relying on it for substantive triage."
    },
    {
      "path": "19",
      "concept_id": "project:priority-19",
      "label": "Project priority 19",
      "definition": "Adopter queue position 19; replace or refine this meaning in the project extension before relying on it for substantive triage."
    },
    {
      "path": "20",
      "concept_id": "project:priority-20",
      "label": "Project priority 20",
      "definition": "Adopter queue position 20; replace or refine this meaning in the project extension before relying on it for substantive triage."
    },
    {
      "path": "21",
      "concept_id": "project:priority-21",
      "label": "Project priority 21",
      "definition": "Adopter queue position 21; replace or refine this meaning in the project extension before relying on it for substantive triage."
    },
    {
      "path": "22",
      "concept_id": "project:priority-22",
      "label": "Project priority 22",
      "definition": "Adopter queue position 22; replace or refine this meaning in the project extension before relying on it for substantive triage."
    },
    {
      "path": "23",
      "concept_id": "project:priority-23",
      "label": "Project priority 23",
      "definition": "Adopter queue position 23; replace or refine this meaning in the project extension before relying on it for substantive triage."
    },
    {
      "path": "24",
      "concept_id": "project:priority-24",
      "label": "Project priority 24",
      "definition": "Adopter queue position 24; replace or refine this meaning in the project extension before relying on it for substantive triage."
    },
    {
      "path": "25",
      "concept_id": "project:priority-25",
      "label": "Project priority 25",
      "definition": "Adopter queue position 25; replace or refine this meaning in the project extension before relying on it for substantive triage."
    },
    {
      "path": "26",
      "concept_id": "project:priority-26",
      "label": "Project priority 26",
      "definition": "Adopter queue position 26; replace or refine this meaning in the project extension before relying on it for substantive triage."
    },
    {
      "path": "27",
      "concept_id": "project:priority-27",
      "label": "Project priority 27",
      "definition": "Adopter queue position 27; replace or refine this meaning in the project extension before relying on it for substantive triage."
    },
    {
      "path": "28",
      "concept_id": "project:priority-28",
      "label": "Project priority 28",
      "definition": "Adopter queue position 28; replace or refine this meaning in the project extension before relying on it for substantive triage."
    },
    {
      "path": "29",
      "concept_id": "project:priority-29",
      "label": "Project priority 29",
      "definition": "Adopter queue position 29; replace or refine this meaning in the project extension before relying on it for substantive triage."
    },
    {
      "path": "30",
      "concept_id": "project:priority-30",
      "label": "Project priority 30",
      "definition": "Adopter queue position 30; replace or refine this meaning in the project extension before relying on it for substantive triage."
    },
    {
      "path": "31",
      "concept_id": "project:priority-31",
      "label": "Project priority 31",
      "definition": "Adopter queue position 31; replace or refine this meaning in the project extension before relying on it for substantive triage."
    },
    {
      "path": "32",
      "concept_id": "project:priority-32",
      "label": "Project priority 32",
      "definition": "Adopter queue position 32; replace or refine this meaning in the project extension before relying on it for substantive triage."
    },
    {
      "path": "33",
      "concept_id": "project:priority-33",
      "label": "Project priority 33",
      "definition": "Adopter queue position 33; replace or refine this meaning in the project extension before relying on it for substantive triage."
    },
    {
      "path": "34",
      "concept_id": "project:priority-34",
      "label": "Project priority 34",
      "definition": "Adopter queue position 34; replace or refine this meaning in the project extension before relying on it for substantive triage."
    },
    {
      "path": "35",
      "concept_id": "project:priority-35",
      "label": "Project priority 35",
      "definition": "Adopter queue position 35; replace or refine this meaning in the project extension before relying on it for substantive triage."
    },
    {
      "path": "36",
      "concept_id": "project:priority-36",
      "label": "Project priority 36",
      "definition": "Adopter queue position 36; replace or refine this meaning in the project extension before relying on it for substantive triage."
    },
    {
      "path": "37",
      "concept_id": "project:priority-37",
      "label": "Project priority 37",
      "definition": "Adopter queue position 37; replace or refine this meaning in the project extension before relying on it for substantive triage."
    },
    {